{
  "acceptance_state": "pass",
  "artifact_ids": [
    "answer"
  ],
  "case_id": "small",
  "execution_state": "completed",
  "id": "small-trial-1",
  "measurements": [
    {
      "id": "sum",
      "state": "observed",
      "value": 10
    }
  ],
  "run_id": "run-demo",
  "schema": "prooflab.case/v1",
  "trial": 1
}
